{
  "event_id": "7b7a08ec-514e-45f4-8b4f-47bed413415c",
  "event_type": "status_transition",
  "occurred_at": "2026-04-29T23:51:37.583Z",
  "work_item_id": {
    "project": "CLV",
    "id": "CLV-89"
  },
  "work_item_type": "task",
  "from_status": "final-gate",
  "to_status": "merged",
  "actor": {
    "kind": "human",
    "id": "local-user"
  },
  "reason": "gate=final_approval_gate; path=full_pipeline"
}
