{
  "event_id": "af7c5c88-1eaf-4d98-a0dc-8ee4119a4efa",
  "event_type": "status_transition",
  "occurred_at": "2026-04-29T18:40:13.655Z",
  "work_item_id": {
    "project": "CLV",
    "id": "CLV-81"
  },
  "work_item_type": "task",
  "from_status": "documenting",
  "to_status": "review",
  "actor": {
    "kind": "agent",
    "id": "implementer"
  }
}
