{
  "event_id": "5595517b-5c7a-4a72-b622-8ad4cdcbf1e7",
  "event_type": "status_transition",
  "occurred_at": "2026-04-25T05:44:40.644Z",
  "work_item_id": {
    "project": "CLV",
    "id": "CLV-29"
  },
  "work_item_type": "task",
  "from_status": "review",
  "to_status": "automated-gates",
  "actor": {
    "kind": "agent",
    "id": "implementer"
  }
}
