{
  "event_id": "evt-2026-04-17-001",
  "event_type": "status_transition",
  "occurred_at": "2026-04-17T10:32:00Z",
  "work_item_id": { "project": "ACME", "id": "ACME-200" },
  "work_item_type": "task",
  "from_status": "documenting",
  "to_status": "council",
  "actor": { "kind": "agent", "id": "implementer" },
  "reason": "Docs complete; advancing into the delivery council phase."
}
