{
  "event_id": "e126276b-d0e6-4671-aa94-cea87ec150a7",
  "event_type": "status_transition",
  "occurred_at": "2026-04-27T22:08:12.035Z",
  "work_item_id": {
    "project": "CLV",
    "id": "CLV-46"
  },
  "work_item_type": "task",
  "from_status": "documenting",
  "to_status": "review",
  "actor": {
    "kind": "agent",
    "id": "implementer"
  }
}
