{
  "event_id": "c9391b0f-96b5-4300-9fd8-b26036216367",
  "event_type": "status_transition",
  "occurred_at": "2026-04-29T00:26:22.974Z",
  "work_item_id": {
    "project": "CLV",
    "id": "CLV-62"
  },
  "work_item_type": "plan",
  "from_status": "drafting",
  "to_status": "gate-pending",
  "actor": {
    "kind": "agent",
    "id": "implementer"
  },
  "reason": "gate=task_batch_gate"
}
