{
  "event_id": "de19d5b6-77d7-4be0-9435-69bd8fbb80f3",
  "event_type": "status_transition",
  "occurred_at": "2026-05-27T13:51:42.654Z",
  "work_item_id": {
    "project": "CLV",
    "id": "CLV-104"
  },
  "work_item_type": "task",
  "from_status": "tactical-plan",
  "to_status": "implementing",
  "actor": {
    "kind": "agent",
    "id": "implementer"
  }
}
