{
  "event_id": "9f508593-2138-435e-a091-39d404edc261",
  "event_type": "status_transition",
  "occurred_at": "2026-04-27T17:54:14.723Z",
  "work_item_id": {
    "project": "CLV",
    "id": "CLV-39"
  },
  "work_item_type": "task",
  "from_status": "automated-gates",
  "to_status": "qa",
  "actor": {
    "kind": "agent",
    "id": "implementer"
  },
  "reason": "gate=--path=full_pipeline"
}
